<?xml version="1.0" encoding="utf-8"?>
<!DOCTYPE ASSETS SYSTEM "assets.dtd">
<ASSETS>
    <Textures/>
    <Music/>
    <Sounds/>
    <Fonts/>
    <Levels>
      <LevelFilePath>Resources/XML/DefaultLevel.xml</LevelFilePath>
    </Levels>
    <Animations/>
    <Renderables>
        <RenderableTexts/>
        <RenderableRectangles/>
        <RenderableCircles/>
        <RenderableSprites/>
    </Renderables>
</ASSETS>
